{
  "project_id": "proj_01J00000000000000000000001",
  "source_identity": "git:example/sdk-validation",
  "adapter_kind": "git-v1",
  "adapter_version": "1.0.0",
  "baseline_source_descriptor": {
    "source_kind": "git",
    "source_locator": "example/sdk-validation",
    "opaque_revision": "base-revision",
    "base_revision": null,
    "adapter_kind": "git-v1",
    "adapter_version": "1.0.0",
    "metadata": {
      "guarantee": "strict",
      "branch": "main"
    }
  },
  "baseline_source_digest": "sha256:aaaaaaaaaaaaaaaaaaaaaaaaaaaaaaaaaaaaaaaaaaaaaaaaaaaaaaaaaaaaaaaa",
  "current_source_descriptor": {
    "source_kind": "git",
    "source_locator": "example/sdk-validation",
    "opaque_revision": "current-revision",
    "base_revision": "base-revision",
    "adapter_kind": "git-v1",
    "adapter_version": "1.0.0",
    "metadata": {
      "guarantee": "strict",
      "branch": "main"
    }
  },
  "current_source_digest": "sha256:bbbbbbbbbbbbbbbbbbbbbbbbbbbbbbbbbbbbbbbbbbbbbbbbbbbbbbbbbbbbbbbb",
  "source_manifest": {
    "schema_version": 1,
    "base_digest": "sha256:aaaaaaaaaaaaaaaaaaaaaaaaaaaaaaaaaaaaaaaaaaaaaaaaaaaaaaaaaaaaaaaa",
    "current_digest": "sha256:bbbbbbbbbbbbbbbbbbbbbbbbbbbbbbbbbbbbbbbbbbbbbbbbbbbbbbbbbbbbbbbb",
    "entries": [
      {
        "anchor": "file:app/Example.php",
        "change_kind": "modified",
        "observed_by": "adapter",
        "content_digest": "sha256:cccccccccccccccccccccccccccccccccccccccccccccccccccccccccccccccc",
        "metadata": {
          "path": "app/Example.php",
          "current_size": 123
        }
      }
    ],
    "ignored_entries": []
  },
  "task_session_correlation_id": "turn-1",
  "feature_id": null,
  "versions": {
    "integration_name": "codex",
    "integration_version": "1.0.0",
    "skill_version": "1.1.0",
    "contract_version": "1.0.0"
  }
}
